{
  "case_id": "AOS-001-TC03",
  "candidate_commit": "61d9e4729ded8e39d7a5ebc1048d803a6cdcab2b",
  "environment_manifest_sha256": "0ee0590f9227d00d4e29f7c14d865e30d314ab3f213ef3c789f0347453f867e9",
  "lane": "integration",
  "execution_mode": "OS_BOUNDARY",
  "verdict": "PASS",
  "command": [
    "uv",
    "run",
    "--frozen",
    "pytest",
    "-m",
    "not live",
    "--junitxml=evidence/AOS-001-S3.xml"
  ],
  "exit_code": 0,
  "report_artifact_ref": "evidence/AOS-001-S3.xml",
  "fixture_sha256": "25639ee7dd54478214c4cf8ec76f93b21678a199d1a00feb4a966cf2460cc0b7",
  "observed_at": "2026-10-12T05:26:56.431134Z"
}
