{
  "case_id": "AOS-005-TC02",
  "candidate_commit": "eb5d6c333fef26abd1daad9ca46563e2128f3c21",
  "environment_manifest_sha256": "d7cbff0255e62a3b7af4f3ba171a1433a71502bb230e92bddf59b454e5e41621",
  "lane": "security",
  "execution_mode": "OS_BOUNDARY",
  "verdict": "PASS",
  "command": [
    "uv",
    "run",
    "--frozen",
    "pytest",
    "-m",
    "not live",
    "--junitxml=evidence/AOS-005-S2.xml"
  ],
  "exit_code": 0,
  "report_artifact_ref": "evidence/AOS-005-S2.xml",
  "fixture_sha256": "9177c4ec481cf480bc866db2adf4fde9c7bb5571c7238016e58833a61d573283",
  "observed_at": "2026-10-12T06:57:27.696016Z"
}
