{
  "case_id": "AOS-003-TC04",
  "candidate_commit": "cd2b6b4e9512108bbb52cce1460c229f613f6874",
  "environment_manifest_sha256": "34d18a3371f930c9acb40bdf306c959bb42b0fbfc2d90449031f9c9ce5d2011d",
  "lane": "integration",
  "execution_mode": "OS_BOUNDARY",
  "verdict": "PASS",
  "command": [
    "uv",
    "run",
    "--frozen",
    "pytest",
    "-m",
    "not live",
    "--junitxml=evidence/AOS-003-S3.xml"
  ],
  "exit_code": 0,
  "report_artifact_ref": "evidence/AOS-003-S3.xml",
  "fixture_sha256": "271a413bd339c5709fdceaec41f14f11e9fbfb5042d72d331c65f32b284cd09a",
  "observed_at": "2026-10-12T06:15:25.190093Z"
}
